day,location,dead,injured,casualty,description,wiki_url,latitude,longitude,target,attack type,weapons,deaths_details,injured_details,perpetrator
"May 15, 2023","Farmington, New Mexico",4,6,10,"2023 Farmington, New Mexico shooting: Three civilians were killed and at least six others, including two police officers, were injured after a 18 year old man opened fire in the city of Farmington, New Mexico. The gunman was killed by police.[9]","https://en.wikipedia.org/wiki/2023_Farmington,_New_Mexico_shooting",36°45′6″N,108°11′23″W,General public,Mass shooting,"AR-15,9mm handgun,.22-caliber handgun",4 (including the perpetrator),10-11 (6 by gunfire),Beau Wilson
"May 6, 2023","Allen, Texas",9,7,16,"2023 Allen, Texas outlet mall shooting: A man opened fire at the Allen Premium Outlets, killing eight people, and injuring at least seven others before being killed by police.[10]","https://en.wikipedia.org/wiki/2023_Allen,_Texas_outlet_mall_shooting",33°07′58″N,96°39′39″W,,"Mass shooting, mass murder",AR-15 style rifle[1],9 (including the perpetrator),7,Mauricio Martinez Garcia
"May 3, 2023","Atlanta, Georgia",1,4,5,"2023 Atlanta shooting: A man opened fire inside a Northside Hospital facility in Midtown Atlanta, killing a 39-year-old woman, and injuring four others, before fleeing the scene. After eight hours of being on the run, the suspect was arrested by police without further incident.[11][12]",https://en.wikipedia.org/wiki/2023_Atlanta_shooting,33°47′07″N,84°23′18″W,,Mass shooting,Handgun,1,4,
"May 1, 2023","Henryetta, Oklahoma",7,0,7,"2023 Henryetta killings: A sex offender killed six people, including four family members, before killing himself at his residence.[13]",https://en.wikipedia.org/wiki/2023_Henryetta_killings,,,,,,,,
"April 28, 2023","Cleveland, Texas",5,0,5,"2023 Cleveland, Texas shooting: A man armed with an AR-15-style rifle opened fire at a home, killing five people, including a child, before fleeing the scene. Three children were covered in blood, but were hospitalized.[14] The suspect, 38-year-old Francisco Oropeza, was captured after a 4-day-long manhunt.[15]","https://en.wikipedia.org/wiki/2023_Cleveland,_Texas_shooting",,,,Mass shooting,AR-15 style rifle[1],5,0,
"April 18, 2023","Bowdoin and Yarmouth, Maine",4,3,7,"2023 Bowdoin–Yarmouth shootings: Four people were killed at a home in Bowdoin, followed by a shooting on a highway in Yarmouth that wounded three family members in the same vehicle. The son of two of the victims in Bowdoin was charged with the shooting.",https://en.wikipedia.org/wiki/2023_Bowdoin%E2%80%93Yarmouth_shootings,,,,"Mass shooting, spree shooting, familicide",Firearm,4,3,
"April 15, 2023","Dadeville, Alabama",4,32,36,"2023 Dadeville shooting: A gunman opened fire at a birthday party, killing four people, and injuring 32 others. Six suspects were taken into custody.[16][17]",https://en.wikipedia.org/wiki/2023_Dadeville_shooting,32°49′54″N,85°45′48″W,,Mass shooting,Handgun(s)[1],4,32,
"April 10, 2023","Louisville, Kentucky",6,8,14,"2023 Louisville shooting: An employee opened fire at a bank, killing five people and injuring eight others, including a police officer that was critically wounded.[18] The perpetrator, 25-year-old Connor Sturgeon, was fatally shot by police.[19]",https://en.wikipedia.org/wiki/2023_Louisville_bank_shooting,38°15′20.51″N,85°44′46.42″W,,"Mass shooting, mass murder, workplace shooting",AR-15 style rifle[2],6 (including the perpetrator),8,Connor James Sturgeon
"March 27, 2023","Nashville, Tennessee",7,1,8,"2023 Covenant School shooting: A former student opened fire at The Covenant School in the Green Hills neighborhood. Six people were killed, three of them children, and one police officer was injured by shattered glass. The perpetrator, 28-year-old Audrey Hale, was fatally shot by police.[20]",https://en.wikipedia.org/wiki/2023_Covenant_School_shooting,36°05′35″N,86°49′32″W,Students and staff at The Covenant School,"Mass murder, mass shooting, school shooting, pedicide","AR-15,Kel-Tec SUB-2000 carbine,Handgun[1]",7 (including the perpetrator),1[a],Aiden Hale[b]
"February 22, 2023","Pine Hills, Florida",3,2,5,Killing of Dylan Lyons: Three people were killed and two others wounded in a series of shootings. A 19-year-old suspect was arrested.[21],https://en.wikipedia.org/wiki/Killing_of_Dylan_Lyons,,,,,,,,
"February 13, 2023","East Lansing, Michigan",4,5,9,2023 Michigan State University shooting: A mass shooting occurred at Michigan State University in East Lansing. Three people were killed and five others injured.[22] The shooter died of a self-inflicted gunshot wound after being cornered by police.[23],https://en.wikipedia.org/wiki/2023_Michigan_State_University_shooting,,,Students at Michigan State University,"Mass shooting, murder–suicide, school shooting","Taurus G3 9mm handgun,Hi-Point C-9 9mm handgun (Unused) [2]",4 (including the perpetrator),5,Anthony Dwayne McRae
"January 28, 2023","Los Angeles, California",3,4,7,2023 Beverly Crest shooting: Three people were killed and four others wounded in an ambush allegedly related to gang violence. Three suspects were arrested for the killings in May 2023.[24],https://en.wikipedia.org/wiki/2023_Beverly_Crest_shooting,34°07′10″N,118°25′33″W,Two partygoers,Mass shooting,Semi-automatic firearms,3,4,
"January 23, 2023","Half Moon Bay, California",7,1,8,"2023 Half Moon Bay shootings: A man opened fire at two farms, killing seven people and injuring one other, before being taken into custody.[25]",https://en.wikipedia.org/wiki/2023_Half_Moon_Bay_shootings,,,,"Mass shooting, workplace violence, spree shooting",Ruger semi-automatic pistol[1],7,1,
"January 21–22, 2023","Monterey Park, California",12,9,21,2023 Monterey Park shooting: Eleven people were killed and nine others injured after a gunman opened fire at a dance studio in Monterey Park after a Chinese New Year celebration in the city. The perpetrator shot and killed himself in a standoff with police the next day.[26],https://en.wikipedia.org/wiki/2023_Monterey_Park_shooting,34°03′43″N,118°07′25″W,People at Star Ballroom Dance Studio and Lai Lai Ballroom,"Mass shooting, mass murder, murder–suicide","Cobray M-11/9 semi-automatic pistol[3],Norinco Type 54 7.62x25mm semi-automatic pistol[4]",12 (including the perpetrator),9,Huu Can Tran
"January 16, 2023","Goshen, California",6,0,6,"2023 Goshen shooting: A baby, a teenager, and four others were killed in a shooting at a home.[27]",https://en.wikipedia.org/wiki/2023_Goshen_shooting,,,,"Mass shooting, mass murder",Firearm,6,0,
"January 4, 2023","Enoch, Utah",8,0,8,"2023 Enoch, Utah shooting: Five children and three adults were killed in a shooting at a home.[28]","https://en.wikipedia.org/wiki/2023_Enoch,_Utah_shooting",,,,"Mass murder, mass shooting, familicide, murder-suicide",Firearm,8 (including the perpetrator),0,Michael Haight
"November 22, 2022","Chesapeake, Virginia",7,4,11,"2022 Chesapeake shooting: Six people were killed, and four others were injured, when a night-shift manager opened fire at a Walmart. The gunman then committed suicide.[29]",https://en.wikipedia.org/wiki/2022_Chesapeake_shooting,36°46′22″N,76°14′56″W,Coworkers,"Mass shooting, murder-suicide, workplace violence",9mm handgun,7 (including the perpetrator),4,Andre Marcus Bing
"November 19–20, 2022","Colorado Springs, Colorado",5,26,31,"Colorado Springs nightclub shooting: A gunman killed five after entering a local gay bar. 26 others, including the gunman, were wounded during the attack, 19 of them by gunfire. A suspect was later taken into custody.",https://en.wikipedia.org/wiki/Colorado_Springs_nightclub_shooting,,,Patrons of Club Q,Mass shooting,"AR-15 style rifle[2][3][4],Handgun",5,26 (including the suspect; 19 by gunfire),
"November 13, 2022","Charlottesville, Virginia",3,2,5,"2022 University of Virginia shooting: A student at the University of Virginia opened fire on a bus returning from a trip to see a play. The three people killed as well as one of the wounded were members of the University of Virginia's football team, and the gunman was a member of the team for one season, though he did not play any games.",https://en.wikipedia.org/wiki/2022_University_of_Virginia_shooting,,,UVA football players and another student,"School shooting, mass shooting",Handgun,3,2,
"October 24, 2022","St. Louis, Missouri",3,7,10,"2022 Central Visual and Performing Arts High School shooting: The shooter, a former student, opened fire, killing two people and wounding four others before being shot and killed by police.[30]",https://en.wikipedia.org/wiki/2022_Central_Visual_and_Performing_Arts_High_School_shooting,38°36′17″N,90°16′15″W,,"Mass shooting, school shooting, shootout",Palmetto State Armory AR-15 style semiautomatic rifle[1][2],3 (including the perpetrator),7 (4 by gunfire),Orlando Harris
"October 13, 2022","Raleigh, North Carolina",5,2,7,"2022 Raleigh shootings: The shooter, a teenager, went on a shooting spree along the Neuse River Trail greenway and surrounding neighborhood.[31]",https://en.wikipedia.org/wiki/2022_Raleigh_shootings,,,,"mass shooting, stabbing, suspected fratricide","Shotgun,Handgun,Hunting knife",5,3 (including the accused),
"September 28, 2022","Oakland, California",1,5,6,2022 Oakland school shooting: Four staff members and two students were shot by multiple gunmen at a complex that houses multiple schools. The shooting may have been tied to gang violence.[32],https://en.wikipedia.org/wiki/2022_Oakland_school_shooting,,,,"School shooting, alleged gang violence",,1 (died from injuries in November 2022),5,
"August 28, 2022","Bend, Oregon",3,2,5,"2022 Bend, Oregon shooting: A local man shot four people, two fatally, in a Safeway supermarket at the Forum shopping center before committing suicide.","https://en.wikipedia.org/wiki/2022_Bend,_Oregon_shooting",44°03′28″N,121°15′54″W,,"Mass shooting, murder–suicide","5.56 Radical Firearms RF-15 semi-automatic rifle,12-Gauge Stevens Model 320 pump-action shotgun",3 (including the perpetrator),2,Ethan Blair Miller
"July 17, 2022","Greenwood, Indiana",4,2,6,Greenwood Park Mall shooting: A local man fatally shot three people and injured two others at the food court in the Greenwood Park Mall before being shot by an armed civilian.,https://en.wikipedia.org/wiki/Greenwood_Park_Mall_shooting,39°37′58″N,86°07′14″W,,Mass shooting,"SIG Sauer M400 semi-automatic rifle (used),Smith & Wesson M&P15 semi-automatic rifle (left at toilet),Glock 33 pistol (carried, not used)",4 (including the perpetrator),2,Jonathan Douglas Sapirman
"July 4, 2022","Highland Park, Illinois",7,48,55,Highland Park parade shooting: Seven people were killed and 48 others injured after a man fired a rifle from a rooftop at spectators attending Highland Park's Fourth of July parade.,https://en.wikipedia.org/wiki/Highland_Park_parade_shooting,42°11′06″N,87°48′04″W,People attending or participating in a Fourth of July parade,Mass shooting,"Smith & Wesson M&P15 semi-automatic rifle,Kel-Tec SUB-2000 (unused)",7,48,
